,ID,Title,Upvotes,Downvotes,Subreddit,Body,URL,Number of Comments,Date Created
117,erplyv,"British economy will grow faster than eurozone rivals, says IMF",73,0,europe,,https://www.thetimes.co.uk/article/british-economy-will-grow-faster-than-eurozone-rivals-says-imf-k2h3vbdjm,123,1579610564.0
118,erphi1,2020 Bloomberg Innovation Index [6 out of top 10 are European],96,0,europe,,https://i.redd.it/i14m9f0x72c41.jpg,75,1579609872.0
119,ern848,Thousands apply for EU border guard posts,28,0,europe,,https://euobserver.com/justice/147186,15,1579598554.0
120,ermmp0,Swiss security services foil a Russian espionage operation in Davos,37,0,europe,,https://www.tagesanzeiger.ch/schweiz/standard/spionage-in-davos-russischer-diplomat-gab-sich-als-handwerker-aus/story/23199265,1,1579595735.0
121,erm2n2,France is making start-up friendly reforms to lure tech talent and take on Silicon Valley,39,0,europe,,https://www.cnbc.com/2020/01/19/france-reforms-employee-stock-options-to-rival-silicon-valley.html,26,1579593136.0
122,erlx8u,2019 was Poland's hottest year on record,3,0,europe,,https://notesfrompoland.com/2020/01/20/2019-was-polands-hottest-year-on-record/,6,1579592457.0
123,erl9xl,Six arguments PiS uses to justify Poland's judicial overhaul,0,0,europe,,https://notesfrompoland.com/2020/01/20/six-arguments-pis-uses-to-justify-polands-judicial-overhaul-and-why-they-are-wrong/,2,1579589771.0
124,erl7mw,Moscow gripped by mysterious bomb hoaxes,11,0,europe,,https://www.bbc.com/news/world-europe-51182331,0,1579589514.0
125,erl0e5,"[Hungarian] Gov’t Finds Court Ruling on School Segregation of Romas ‘Unfortunate’, Refuses to Pay Compensation",15,0,europe,,https://hungarytoday.hu/govt-finds-court-ruling-on-school-segregation-of-romas-unfortunate-refuses-to-pay-compensation/,1,1579588659.0
126,erkq8j,"Jarramplas 2020, El Piornal, Spain",2,0,europe,,https://www.youtube.com/watch?v=te1G7uHCJJQ,1,1579587496.0
127,erkkr8,UK issues commemorative coin celebrating rock band Queen,3,0,europe,,https://www.reuters.com/article/us-music-queen-coin-idUSKBN1ZJ0YZ,4,1579586855.0
128,erk6zh,Germany jails man for tricking women into electric shocks,59,0,europe,,https://apnews.com/c176075ba77590b6d08008c3b7826fab,16,1579585280.0
129,erk4ne,Germany breaks S Korea's streak as most innovative nation,310,0,europe,,https://www.businesstimes.com.sg/government-economy/germany-breaks-s-koreas-streak-as-most-innovative-nation,152,1579585016.0
130,erj54d,Is Israel snubbing Poland to placate Putin?,75,0,europe,,https://www.jpost.com/Opinion/Is-Israel-snubbing-Poland-to-placate-Putin-614745,64,1579581056.0
131,erjenw,Where are the stars? Europe has lost its dark night skies,101,0,europe,"Europe has almost completely lost its dark night skies, maybe forever.

If do you want to see a sky with all of its stars, now you have to go thousands of km's for this purpose.

It’s been estimated that 99 percent of people in the United States and Europe can no longer see that milky swath of the Milky Way.

We’ve got whole generations of people in the North America & Europe who have never seen the Milky Way. It’s a big part of our connection to the cosmos — and it’s been lost.

The only areas that are still truly dark there, are some little portions (in black) within Iceland; Scandinavia, and some very remote Russia.

&#x200B;

&#x200B;

[Light pollution map](https://preview.redd.it/iqphfixwszb41.jpg?width=889&format=pjpg&auto=webp&s=682c5eac1aee854e7e28f0837c691a79097ffa38)

[Here](https://darksitefinder.com/maps/world.html#2/41.6/46.8) is the dark site finder of the Earth, for the curious.

[Here](https://www.youtube.com/watch?v=0FXJUP6_O1w) is a scale of the light pollution influence.

[Here](https://i.imgur.com/mI19OcJ.jpg) is how street lighting should illuminate properly.

&#x200B;

If do you want more information about this terrible phenomenon, you can find below:

\- [A](https://www.youtube.com/watch?v=V_A78zDBwYE&t=39s)

\- [B](https://www.youtube.com/watch?v=XJXsIeqOKT0&t=7s)

\- [C](https://www.youtube.com/watch?v=v_2yhSczQ1A)

\- [D](https://www.youtube.com/watch?v=_nlFcEj41Xk)

&#x200B;

The [International Dark Sky Association](https://www.darksky.org/), which works to protect the night sky, offers extensive analysis on light pollution, along with suggestions for how governments and individuals can make change.

&#x200B;

So take care with artificial light!",https://www.reddit.com/r/europe/comments/erjenw/where_are_the_stars_europe_has_lost_its_dark/,44,1579582095.0
132,erj7fz,Highway network expansion in Portugal (1941-2016),145,0,europe,,https://i.imgur.com/FT30DWa.gif,33,1579581305.0
133,erj13v,The results of Lithuanian public opinion survey: Do you trust or distrust in these institutions?,632,0,europe,,https://i.imgur.com/LObfvk5.png,138,1579580616.0
134,erishq,"EU citizenship, but no shoes: the Roma of Bulgaria",0,0,europe,,https://www.opendemocracy.net/en/can-europe-make-it/eu-citizenship-no-shoes-roma-bulgaria/,10,1579579674.0
135,erin8n,Italy Senate panel says Salvini kidnapping probe should go ahead,4,0,europe,,https://www.reuters.com/article/us-italy-salvini-migrants-trial/italy-senate-panel-says-salvini-kidnapping-probe-should-go-ahead-idUSKBN1ZJ22O,16,1579579111.0
136,erijh2,"Miercurea Ciuc, „Márton Áron” highschool, Romania",109,0,europe,,https://i.redd.it/aw9za7z8swb41.jpg,1,1579578705.0
137,erid2j,German warship suspected of violating Finnish waters,50,0,europe,,https://yle.fi/uutiset/osasto/news/german_warship_suspected_of_violating_finnish_waters/11166905,49,1579578015.0
138,eribi6,EU invests €1 trillion to make its economy more ecology-friendly,2512,0,europe,,https://www.tornosnews.gr/en/tornos/green-travel/38549-eu-invests-e1-trillion-to-make-its-economy-more-ecology-friendly.html,405,1579577835.0
139,eri8sv,"The hidden side of Coimbra, Portugal before the storm",17,0,europe,,https://i.imgur.com/VhSFo7G.jpg,0,1579577550.0
140,eri88w,"Couple receive 23,000 applications to work on the great blasket Island for 6 months.",13,0,europe,,https://www.rte.ie/news/munster/2020/0120/1108621-blasket-islands/,0,1579577496.0
141,eri65b,EU to expand sanctions on Turkey over east Mediterranean gas drilling,775,0,europe,,https://ahvalnews-com.cdn.ampproject.org/c/s/ahvalnews.com/turkey-sanctions/eu-expand-sanctions-turkey-over-east-mediterranean-gas-drilling?amp,261,1579577267.0
142,eri4b8,"The Attack on Exarchia, an Anarchist Refuge in Athens",0,0,europe,,https://www.newyorker.com/news/dispatch/the-attack-on-exarchia-an-anarchist-refuge-in-athens,0,1579577076.0
143,eri2gl,Oleiros - Portugal,19,0,europe,,https://i.imgur.com/Th4eCyu.jpg,0,1579576868.0
144,eri1fy,"Majority of Britons admit to feeling lonely, finds study",10,0,europe,,https://www.independent.co.uk/life-style/loneliness-friendship-adults-shy-time-social-media-study-a9291776.html,19,1579576755.0
145,eri0ry,Winter sunset - Transylvania - Romania,804,0,europe,,https://i.redd.it/0c3z8hu4hzb41.jpg,41,1579576678.0
146,eri0ef,Norway's governing coalition collapses over ISIS repatriation,293,0,europe,,https://edition.cnn.com/2020/01/20/europe/norway-government-collapse-isis-intl/index.html,223,1579576638.0
147,erhxu5,Malaysia returns 42 containers of 'illegal' plastic waste to UK,307,0,europe,,https://www.bbc.co.uk/news/uk-51176312,26,1579576343.0
148,erhwis,I think we all need to shore up our ‘Sisu’ these days...,1,0,europe,,https://www.gossamer.co/articles/sisu-hot-and-unbothered,0,1579576208.0
149,erhouu,Only 35 percent of Serbian citizens in favor of EU membership,137,0,europe,,https://www.danas.rs/drustvo/faktor-plus-samo-35-odsto-gradjana-srbije-za-eu/,253,1579575351.0
150,erhnjq,"Global corporate tax system must be overhauled, Apple CEO",38,0,europe,,https://www.rte.ie/news/business/2020/0120/1108587-irish-award-for-apples-cook/,6,1579575203.0
151,erhl6f,EU to use revamped ‘Operation Sophia’ to enforce Libyan arms embargo,11,0,europe,,https://www.euractiv.com/section/global-europe/news/eu-to-use-revamped-operation-sophia-to-enforce-libyan-arms-embargo/,0,1579574931.0
152,erh96c,"Sunrise in Groningen, The Netherlands this morning",169,0,europe,,https://i.redd.it/71keh8038zb41.jpg,17,1579573585.0
153,erh6hb,Row in Spain over far-right party's parental veto policy for classes,0,0,europe,,https://www.theguardian.com/world/2020/jan/20/spains-government-vows-to-overturn-parental-pin-initiative,10,1579573293.0
154,erh25m,"Iain Macwhirter: In post-Brexit Britain, Nicola Sturgeon can't keep telling her troops that Indyref2 is round the corner. It isn't",2,0,europe,,https://www.heraldscotland.com/news/18170968.iain-macwhirter-post-brexit-britain-nicola-sturgeon-cant-keep-telling-troops-indyref2-round-corner-isnt/,5,1579572799.0
155,erh061,IMF warns EU-US tensions could impact global growth,5,0,europe,,https://www.euractiv.com/section/economy-jobs/news/imf-warns-eu-us-tensions-could-impact-global-growth/,0,1579572594.0
156,ergpqb,Degraded land begins to bloom thanks to European composting project,25,0,europe,,https://www.euronews.com/2020/01/20/degraded-land-begins-to-bloom-thanks-to-european-composting-project,1,1579571443.0
157,ergjow,Eight member states back European-led naval mission in Strait of Hormuz,20,0,europe,,https://www.euractiv.com/section/global-europe/news/eight-member-states-back-european-led-naval-mission-in-strait-of-hormuz/,7,1579570812.0
158,ergi54,Franz Kafka head - Prague city center - OC,245,0,europe,,https://i.redd.it/5dz0uimbzyb41.jpg,8,1579570642.0
159,erg4ka,Democracy and the rule of law: Failing partnership?,0,0,europe,,https://www.cer.eu/publications/archive/policy-brief/2020/democracy-and-rule-law-failing-partnership,0,1579569133.0
160,erfybg,Why has the entire Russian government resigned?,2,0,europe,,https://www.youtube.com/watch?v=Y16lkUDB5Y4,7,1579568481.0
161,erffki,"VIENNA - New defence minister vows to make the army fully functional, again. Vows ""Europeanisation of security policy""",10,0,europe,,https://www.euractiv.com/section/all/short_news/vienna-new-defence-minister-vows-to-make-the-army-fully-functional-again/,3,1579566348.0
162,erfoqs,'The streets are more alive': Ghent readers on a car-free city centre,209,0,europe,,https://www.theguardian.com/environment/2020/jan/20/the-streets-are-more-alive-ghent-readers-on-a-car-free-city-centre,38,1579567415.0
163,erfl8b,Orban May Win Reprieve as EU Party Divided Over Expulsion,11,0,europe,,https://www.bloomberg.com/news/articles/2020-01-20/orban-poised-to-win-reprieve-as-eu-party-divided-over-expulsion,5,1579566999.0
164,erfklm,"Erdogan claims that Crete, islands have no continental shelf | Kathimerini",334,0,europe,,http://www.ekathimerini.com/248626/article/ekathimerini/news/erdogan-claims-that-crete-islands-have-no-continental-shelf,173,1579566930.0
165,erfc0r,Croatian EU presidency: 'we don't believe in sanctions on Hungary and Poland',110,0,europe,,https://www.euronews.com/2020/01/20/croatian-eu-presidency-we-don-t-believe-in-sanctions-on-hungary-and-poland,148,1579565944.0
166,erf9s4,5G: The outsourced elephant in the room - Most European service providers have long lost control over their networks,93,0,europe,,https://berthub.eu/articles/posts/5g-elephant-in-the-room/,5,1579565675.0
167,erf89d,Iran threatens to quit global nuclear pact if Europeans turn to Security Council,12,0,europe,,https://www.timesofisrael.com/iran-threatens-to-quit-global-nuclear-pact-if-europeans-turn-to-security-council/,0,1579565498.0
168,erf01e,"The EU, main loser of the China-US agreement",7,0,europe,,https://www.dlacalle.com/en/the-eu-main-loser-of-the-china-us-agreement/,8,1579564558.0
169,ereini,2 in 3 Russians Believe Russia Has Political Prisoners – Poll,159,0,europe,,https://www.themoscowtimes.com/2020/01/20/2-in-3-russians-believe-russia-has-political-prisoners-poll-a68975,39,1579562394.0
170,ere3hw,Leaders Hail Restoration of Belgrade-Pristina Air Link,10,0,europe,,https://balkaninsight.com/2020/01/20/lufthansa-plans-to-connect-belgrade-and-pristina/,0,1579560416.0
171,ere1fl,UK house prices rise at fastest rate on record,11,0,europe,,https://www.theguardian.com/business/2020/jan/20/uk-house-prices-rise-at-fastest-rate-on-record,12,1579560131.0
172,erdvc5,Czech wardrobe 19.th century- OC!! Folklore Museum Prague,12,0,europe,,https://i.redd.it/bjoc7pcm1yb41.jpg,0,1579559309.0
173,erdmtx,IMF predicts stable growth after Britians exit from EU,35,0,europe,,https://www.itv.com/news/2020-01-20/brexit-international-monetary-fund-forecast-imf-britain-growth/,28,1579558107.0
174,erdmhs,Global Social Mobility Index 2020: All top 10 are from Europe,129,0,europe,,https://i.redd.it/ms2yhnyqxxb41.png,60,1579558056.0
175,erdldf,Ease of Doing Business Scores (2020),155,0,europe,,https://i.redd.it/ehv0rb0exxb41.png,64,1579557888.0
176,erdl31,"Prague, Czech Republic - June, 4:30 am",93,0,europe,,https://i.imgur.com/3Rj44L5.jpg,0,1579557848.0
177,erdl0m,John Bercow 'nominated for a peerage by Jeremy Corbyn',6,0,europe,,https://inews.co.uk/news/politics/john-bercow-nominated-for-a-peerage-by-jeremy-corbyn-1369414,7,1579557837.0
178,erdkdm,"On this day 100 years ago, Federico Fellini, one of the greatest filmakers of the postwar era was born in Rimini, Italy.",237,0,europe,,https://i.redd.it/7lpwkv7twxb41.jpg,9,1579557738.0
179,erddh8,Video of French officer beating protester probed,29,0,europe,,https://www.bbc.co.uk/news/world-europe-51174778,12,1579556698.0
180,erd6vm,Germany: Number of asylum-seeker deportations fell in 2019,33,0,europe,,https://www.dw.com/en/germany-number-of-asylum-seeker-deportations-fell-in-2019/a-51971551,22,1579555666.0
181,erd8eq,"Dublin, Ireland",16,0,europe,,https://i.redd.it/heocmmckrxb41.jpg,8,1579555920.0
182,erd4nx,Ireland has fifth largest number of billionaires per capita,5,0,europe,,https://www.rte.ie/news/ireland/2020/0120/1108528-oxfam-wealth-study/,17,1579555324.0
183,erd3m8,"[The italian public company] Leonardo has been chosen to supply 32 training helicopters to the US Navy, a deal worth 176 million dollars.",49,0,europe,,https://www.ilsole24ore.com/art/leonardo-vince-commessa-usa-ACRsjqBB,11,1579555153.0
184,erd108,Family of backpacker jailed in Russia asked to lie low ahead of Putin visit,13,0,europe,,https://www.timesofisrael.com/family-of-backpacker-jailed-in-russia-asked-to-lay-low-ahead-of-putin-visit/,4,1579554728.0
185,erd0nm,British territory Gibraltar 'could stay in Schengen Area after Brexit',3,0,europe,,https://www.euronews.com/2020/01/18/british-territory-gibraltar-could-stay-in-schengen-area-after-brexit,6,1579554673.0
186,ercs2q,Video of French officer beating protester probed,9,0,europe,,https://www.bbc.com/news/world-europe-51174778,0,1579553297.0
187,ercrmz,2€ Italy 2005: there's a reason why you'd better wait to commemorate things,59,0,europe,,https://i.redd.it/8yxgm8sjjxb41.jpg,37,1579553224.0
188,erb2om,Europe’s migration crisis seen from orbit,0,0,europe,,https://www.politico.eu/article/europe-migration-crisis-seen-from-space-satellites-artificial-intelligence/,2,1579541525.0
189,erb4m4,Muslim world leaders visit Auschwitz in 'strong signal' of interfaith support,9,0,europe,,https://www.dw.com/en/muslim-world-leaders-visit-auschwitz-in-strong-signal-of-interfaith-support/a-52034131,5,1579541938.0
190,ercjig,'People over passports': Johnson says Africans will benefit from Brexit as £620m funding announced,9,0,europe,,https://www.itv.com/news/2020-01-20/boris-johnson-africa-summit-brexit/,7,1579551729.0
191,erccpz,France signals support for Greece as Turkey pushes demands in East Med,425,0,europe,,http://www.ekathimerini.com/248571/article/ekathimerini/news/france-signals-support-for-greece-as-turkey-pushes-demands-in-east-med,317,1579550494.0
192,erc59d,15 arrested in Spain in inedible horsemeat scam,16,0,europe,,https://www.europol.europa.eu/newsroom/news/15-arrested-in-spain-in-inedible-horsemeat-scam,3,1579549081.0
193,erbwf7,Former EU Diplomat Loses Security Clearance over Allegations of Spying for China,39,0,europe,,https://www.neweurope.eu/article/former-eu-diplomat-loses-security-clearance-over-allegations-of-spying-for-china/,0,1579547398.0
194,erbuxn,A thousand EU financial firms plan to open UK offices after Brexit,62,0,europe,,https://uk.mobile.reuters.com/article/amp/idUKKBN1ZJ00L,30,1579547112.0
195,erbjh5,Helsinki Eyes New 6-Hour High-Speed Train to Moscow,76,0,europe,,https://www.themoscowtimes.com/2020/01/20/helsinki-eyes-new-6-hour-bullet-train-to-moscow-a68962,27,1579544880.0
196,erbica,Number of graduates (bachelor and master) having participated in a short term mobility programme (mainly ERASMUS).,11,0,europe,,https://i.redd.it/3a6vn4idtwb41.png,4,1579544660.0
197,erbev9,Serbian countryside,648,0,europe,,https://i.imgur.com/rbLwxsp.jpg,38,1579543983.0
198,erbd03,"Record high pressure over Europe this morning, reaching 1050 hPa",16,0,europe,,https://www.severe-weather.eu/mcd/update-surface-pressure-1050mbar-peaks-tonight-mk/,6,1579543615.0
199,erbbha,"A map of incoming Erasmus students, now per capita",194,0,europe,,https://i.redd.it/hnzhhma1qwb41.png,70,1579543329.0
