,ID,Title,Upvotes,Downvotes,Subreddit,Body,URL,Number of Comments,Date Created
0,es4xf2,The grooming gang cover-up is Britain’s real racism scandal,7,0,europe,,https://www.telegraph.co.uk/women/life/tolerant-nation-time-shamed-grooming-gangs-prey-girls/,6,1579686593.0
1,es4wvu,Studying Computer Science in the EU/EEA as an Australian citizen,0,0,europe,"Dear fellow Redditors,

Recently I have been browsing through European universities, looking for the cheapest and easiest (in terms of admission) Bachelor of Computer Science (preferably heavily leaning towards software engineering) degrees to get.

I'm a bit worried about my chances of ever being accepted because;
 
1. I'm an Australian citizen only,
2. I only speak English, and
3. I'm 4 years out of high school and never received an ATAR (NSW high school ranking system - similar to British A-levels).

I have, however, received a Certificate IV in Programming at TAFE NSW (college, not university) and have 5+ months' experience of working professionally in the software engineering sector within Sydney.

Having said this, would anyone happen to know of any cheap (or even ~free, like with Deutschland!) universities which would potentially allow me to study there? Do I need to study at university in Australia first (I've been accepted into local universities)?

There have been some instances where universities offered Computer Science at around 2.000/4.000EUR per year, such as Saxion University of Applied Sciences in the Netherlands. Is this potentially the cheapest I could get as an international student?

Many, many thanks,

VoidTheSecond",https://www.reddit.com/r/europe/comments/es4wvu/studying_computer_science_in_the_eueea_as_an/,0,1579686522.0
2,es4crt,20 things you always wanted (but never dared) to ask Europol,4,0,europe,,https://www.europol.europa.eu/about-europol/europol-20-years/20-things-you-always-wanted-never-dared-to-ask-europol,0,1579683862.0
3,es4bm2,15 arrested in Spain in inedible horsemeat scam,3,0,europe,,https://www.europol.europa.eu/newsroom/news/15-arrested-in-spain-in-inedible-horsemeat-scam,1,1579683709.0
4,es422f,What would happen to the Finnish Government if a coalition couldn't be reached between parties after the election?,2,0,europe,"I was wondering what would happen to a Finnish government if no coalition could be reached by the party holding the most seats, would re-election occur? If not, what would occur? -A person doing a project on Finland who can't find the answers.",https://www.reddit.com/r/europe/comments/es422f/what_would_happen_to_the_finnish_government_if_a/,0,1579682448.0
5,es3u5h,"PKN ups Saudi crude purchases for Poland, Lithuania, Czech refineries - Russian crude usage steadily reducing",3,0,europe,,https://www.spglobal.com/platts/en/market-insights/latest-news/oil/012120-pkn-ups-saudi-crude-purchases-for-poland-lithuania-czech-refineries,0,1579681464.0
6,es30k4,EU-Kazakhstan to deepen ties,5,0,europe,,https://www.neweurope.eu/article/eu-kazakhstan-to-deepen-ties/,1,1579677695.0
7,es2xsz,Will university autonomy be limited?,0,0,europe,,https://queer.pl/news/203936/czy-autonomia-uczelni-zostanie-ograniczona,2,1579677349.0
8,es2p5k,Health is the major Irish electoral issue (40% of voters).,1,0,europe,"The other priorities are:

Housing 32%

Economy 8%

Public spending 7%

Climate change 7%

Brexit 3%

All others 2%

Data taken from [Irish Times](https://www.irishtimes.com/news/politics/irish-times-poll-health-and-housing-are-most-important-issues-for-voters-1.4146920): non-paywalled source [here](https://twitter.com/EOBroin/status/1219715662123274246).",https://www.reddit.com/r/europe/comments/es2p5k/health_is_the_major_irish_electoral_issue_40_of/,0,1579676301.0
9,es2l6n,Orbán: New conservative group needed if EPP stays on ‘liberal’ path,0,0,europe,,https://www.politico.eu/article/orban-new-initiative-needed-epp-stays-liberal-path/,2,1579675875.0
10,es23gi,Europeans who use their state language at home,47,0,europe,,https://i.redd.it/mw9084mbi7c41.jpg,26,1579673881.0
11,es22ml,Drones Target Polluters in One of Europe’s Smoggiest Places,2,0,europe,,https://www.bloomberg.com/news/features/2020-01-15/krakow-is-policing-clean-air-with-drones,0,1579673777.0
12,es1tyb,Macron escorted by police as protesters try to storm theater - CNN,8,0,europe,,https://edition.cnn.com/2020/01/18/europe/france-macron-protests-intl/index.html,1,1579672713.0
13,es1qph,European air fleet groups in millions of passengers in 2019,4,0,europe,,https://i.redd.it/dge3osagd7c41.jpg,4,1579672286.0
14,es1ewt,"Brazil: Vale, German auditor charged over dam disaster",4,0,europe,,https://m.dw.com/en/brazil-vale-german-auditor-charged-over-dam-disaster/a-52102094,0,1579671020.0
15,es1ec0,I think it can happen again' — Holocaust survivor meets Merkel ahead of Auschwitz liberation anniversary,16,0,europe,,https://m.dw.com/en/i-think-it-can-happen-again-holocaust-survivor-meets-merkel-ahead-of-auschwitz-liberation-anniversary/a-52097360,21,1579670958.0
16,es18tr,Spanish olive growers claim first victory against U.S. duties,15,0,europe,,https://www.reuters.com/article/us-usa-trade-spain/spanish-olive-growers-claim-first-victory-against-u-s-duties-idUSKBN1ZK2D7,0,1579670350.0
17,erzuf8,The case for a border carbon tax as an own resource to the EU budget,6,0,europe,,https://www.euractiv.com/section/economy-jobs/opinion/the-case-for-a-border-carbon-tax-as-an-own-resource-to-the-eu-budget/,5,1579664570.0
18,es154h,General strike on Lesvos and Limnos,3,0,europe,,https://int.ert.gr/general-strike-on-lesvos-and-limnos-over-vat-hikes-on-wednesday/,1,1579669933.0
19,es0ort,Serbia flies yellow-badge flag to honor Holocaust victims,15,0,europe,,https://www.jpost.com/Diaspora/Antisemitism/Serbia-flies-yellow-badge-flag-to-honor-holocaust-victims-614786,0,1579668086.0
20,es108z,Romanian mayor proposes assessement of couples who want to have children,7,0,europe,,https://www.romania-insider.com/dorin-florea-assesement-couples,8,1579669386.0
21,es0znm,"Report warns of low healthcare spending in Poland, where life expectancy is declining",10,0,europe,,https://notesfrompoland.com/2020/01/21/reports-warns-of-low-healthcare-spending-in-poland-where-life-expectancy-is-declining/,2,1579669324.0
22,es0yot,Military Drill “Defender Europe 2020” Initiates in Europe,10,0,europe,,http://georgiatoday.ge/news/19122/Historical-Military-Drill-%E2%80%9CDefender-Europe-2020%E2%80%9D-Initiates-in-Europe-,0,1579669215.0
23,es0uv5,Swiss police 'exposed Russian spies in Davos',51,0,europe,,https://www.bbc.com/news/world-europe-51196659,1,1579668783.0
24,es0sgk,Polish presidential election poll assuming run-off between Duda and Kidawa-Błońska. Duda: 50.09% / Kidawa-Błońska: 49.91%,27,0,europe,,https://i.redd.it/625ww5p727c41.jpg,24,1579668511.0
25,es0qvs,Russian ‘Plumbers’ Questioned at Davos Over Espionage Suspicions,24,0,europe,,https://www.themoscowtimes.com/2020/01/21/russian-plumbers-questioned-at-davos-over-espionage-suspicions-report-a68988,0,1579668331.0
26,es0ou9,Apology after French textbook links CIA to 9/11,16,0,europe,,https://www.bbc.com/news/world-europe-51187970,5,1579668092.0
27,es0azx,Watzmann (mountain) and Koenigssee (lake),22,0,europe,,https://i.imgur.com/gEpvWKS.jpg,2,1579666501.0
28,es0amr,Moscow’s Holocaust revisionism - Polish PM,22,0,europe,,https://www.politico.eu/article/moscows-holocaust-revisionism-world-war-russia-auschwitz-nazi-germany-soviet-union/,3,1579666459.0
29,erzyvf,Microsoft and Google just can't agree on proposed [EU] ban on facial recognition,27,0,europe,,https://www.zdnet.com/article/microsoft-and-google-just-cant-agree-on-proposed-ban-on-facial-recognition/,2,1579665095.0
30,erzx0w,"Singer House, Saint Peterburg",12,0,europe,,https://i.redd.it/wdtyo8k4o6c41.jpg,0,1579664882.0
31,erzuzi,"Ai Weiwei on his new life in Britain: 'People are at least polite. In Germany, they weren't.'",23,0,europe,,https://www.theguardian.com/artanddesign/2020/jan/21/ai-weiwei-on-his-new-life-in-britain-germany-virtual-reality-film,54,1579664640.0
32,erzjku,"Ancient Delphi, Greece",38,0,europe,,https://i.redd.it/99ted82336c41.jpg,0,1579663317.0
33,erzhsz,"Parkway ""Esplanadi"" in Helsinki, Finland (Last Saturday, at 20:31 local time)",8,0,europe,,https://i.redd.it/50si7xu1m6c41.jpg,0,1579663116.0
34,erz6we,"Today's sunrise in the front of my home (The Baltic Sea Coast, Greater-Helsinki region, Finland)",12,0,europe,,https://i.redd.it/wg0bq26ci6c41.jpg,0,1579661972.0
35,erz4eq,"The New Central Library ""Oodi"" in Helsinki, Finland (yesterday evening)",35,0,europe,,https://i.redd.it/fpj8m7suh6c41.jpg,13,1579661702.0
36,eryzgt,"UK, India Creative Institutions Collaborate On Bollywood, UK Film Industries",8,0,europe,,http://bweducation.businessworld.in/article/UK-India-Creative-Institutions-Collaborate-On-Bollywood-UK-Film-Industries/21-01-2020-182466/,0,1579661072.0
37,eryvwr,Medvedev Says He's Hanging On To United Russia Party Chairmanship,0,0,europe,,https://www.rferl.org/a/medvedev-united-russia-party-chairmanship/30385586.html,1,1579660625.0
38,eryvvp,Northern Ireland unemployment hits 'record low',2,0,europe,,https://www.bbc.co.uk/news/uk-northern-ireland-51189883,0,1579660621.0
39,eryrt9,Estonia not to be represented at Holocaust remembrance event in Israel,23,0,europe,,https://news.err.ee/1026258/estonia-not-to-be-represented-at-holocaust-remembrance-event-in-israel,2,1579660115.0
40,eryqdz,Ozzy Osbourne reveals Parkinson's diagnosis,2,0,europe,,https://www.bbc.co.uk/news/entertainment-arts-51191615,2,1579659930.0
41,erypz8,The Russian campaign against Poland is accelerating. “Joseph Stalin was right to order the murder in Katyn”,261,0,europe,,https://wiadomosci.onet.pl/tylko-w-onecie/rosyjska-kampania-przeciw-polsce-sie-rozpedza-jozef-stalin-mial-racje-nakazujac-mord/kkcc3je,109,1579659880.0
42,erypsp,Titanic wreck protected under UK and US agreement,11,0,europe,,https://www.bbc.com/news/uk-northern-ireland-51188909,4,1579659859.0
43,eryohh,"On this day in 1793, Louis XVI of France was executed by guillotine after being found guilty of treason by the French National Convention",79,0,europe,,https://www.biography.com/royalty/louis-xvi,26,1579659705.0
44,eryodp,'We just want to say goodbye' - Pro-EU campaigner plans to mark Brexit with procession,1,0,europe,,https://www.theneweuropean.co.uk/top-stories/let-them-mock-our-pro-eu-procession-we-just-want-to-say-goodbye-1-6476418,0,1579659692.0
45,eryni8,EU to use revamped ‘Operation Sophia’ to enforce Libyan arms embargo,10,0,europe,,https://www.euractiv.com/section/global-europe/news/eu-to-use-revamped-operation-sophia-to-enforce-libyan-arms-embargo/,0,1579659589.0
46,eryiu9,A Brexit Party MEP just complained that leaving the EU leaves UK with no representation,3,0,europe,,https://www.theneweuropean.co.uk/top-stories/june-mummery-tweet-about-brexit-and-fisheries-committee-1-6474994,11,1579659047.0
47,eryito,"French health minister warns over Chinese virus, says response ’must be European.’",21,0,europe,,https://www.politico.eu/article/french-health-minister-calls-for-european-response-to-chinese-virus/,6,1579659044.0
48,eryg60,U.S threatens UK with tariffs if Boris Johnson imposes taxes on tech giants,3,0,europe,,https://www.independent.co.uk/news/uk/politics/boris-johnson-tax-tech-trump-mnuchin-brexit-trade-deal-macron-a9294661.html,0,1579658724.0
49,erybw8,Brexit Party MEP complains about not having say on EU law after Brexit,1,0,europe,,https://www.independent.co.uk/news/uk/politics/brexit-party-mep-june-mummery-european-parliament-trade-deal-commission-a9294051.html?utm_source=reddit.com,7,1579658225.0
50,ery8uc,Lukashenka Says Russia Blocking Kazakhstan From Delivering Oil To Belarus,72,0,europe,,https://www.rferl.org/a/lukashenka-says-russia-blocking-kazakhstan-from-delivering-oil-to-belarus/30389521.html,23,1579657843.0
51,ery76n,"Alphabet CEO backs temporary ban on facial-recognition, Microsoft disagrees. EU",8,0,europe,,https://www.reuters.com/article/us-google-eu/alphabet-ceo-backs-temporary-ban-on-facial-recognition-microsoft-disagrees-idUSKBN1ZJ18O,3,1579657666.0
52,ery6ri,Belarus to import oil from Norway's Johan Sverdrup field: Belneftekhim,16,0,europe,,https://www.reuters.com/article/us-belarus-oil-russia/belarus-to-import-oil-from-norways-johan-sverdrup-field-belneftekhim-idUSKBN1ZJ1UQ,9,1579657615.0
53,ery6ms,Ukraine coat of arms in UK anti-terror list furore,0,0,europe,,https://www.bbc.com/news/blogs-trending-51174898,12,1579657598.0
54,ery4mh,'Crushed by Brexit': how Labour lost the election,0,0,europe,,https://www.theguardian.com/politics/2020/jan/21/crushed-by-brexit-how-labour-lost-the-election,4,1579657351.0
55,ery2ap,"Spain to introduce low-emission zones amid ""climate emergency""",1,0,europe,,http://news.trust.org//item/20200121162754-r3uhe/,0,1579657078.0
56,ery1wg,EU to Add Vetting of Climate Results to Fiscal Monitoring,3,0,europe,,https://www.nytimes.com/reuters/2020/01/20/world/europe/20reuters-eurozone-eurogroup-gentiloni.html,0,1579657027.0
57,erxwcg,"Uncovered, Polish Jews' pre-Holocaust plea to Chamberlain: Let us into Palestine",7,0,europe,,https://www.timesofisrael.com/uncovered-polish-jews-pre-holocaust-plea-to-chamberlain-let-us-into-palestine/,0,1579656364.0
58,erxr5d,Pet passports: EU to crack down on criminals abusing the system,7,0,europe,,https://uk.reuters.com/article/us-eu-pets/pet-passports-eu-to-crack-down-on-criminals-abusing-the-system-idUKKBN1ZK1Y3,1,1579655772.0
59,erxqmo,Spain's new government spars with right on region's sex education veto,0,0,europe,,https://uk.reuters.com/article/uk-spain-rights-education/spains-new-government-spars-with-right-on-regions-sex-education-veto-idUKKBN1ZK241,0,1579655720.0
60,erxpoz,"UK shrugs off Brexit uncertainty with backing of global CEOs. UK 4th most important global growth target for CEOs, behind USA, China and Germany. “Viewed against the turbulent global backdrop, the UK is a beacon of relative stability”",27,0,europe,,https://www.theguardian.com/business/2020/jan/20/uk-shrugs-off-brexit-uncertainty-with-backing-of-global-ceos,13,1579655629.0
61,erxonj,German Investor Morale Hits 4-1/2-Year High,6,0,europe,,https://tradingeconomics.com/germany/zew-economic-sentiment-index,0,1579655524.0
62,erxglk,'It would be kinder to shoot them': Ireland's calves set for live export,6,0,europe,,https://theguardian.com/environment/2020/jan/20/it-would-be-kinder-to-shoot-them-irelands-calves-set-for-live-export?__twitter_impression=true,1,1579654733.0
63,erwzoh,IMF revised its growth forecasts: British economy ‘to grow faster than eurozone’,71,0,europe,,https://www.theweek.co.uk/105298/imf-british-economy-to-grow-faster-than-eurozone,34,1579652895.0
64,erwqxg,What do you know about... Norway?,24,0,europe,"**Disclaimer:** We have decided to drop the section with bullet points about the countries because we want to see what *you* know about the countries, not what a mod can cobble together with wikipedia. These posts will happen on every tuesday. 

***

This is the second part of our third series about the countries of Europe. 

Today's country:

# Norway

What do *you* know about Norway?",https://www.reddit.com/r/europe/comments/erwqxg/what_do_you_know_about_norway/,91,1579651981.0
65,erwnhj,EU bank lends €64m to support wind farms in Poland,39,0,europe,,https://www.energylivenews.com/2020/01/21/eu-bank-lends-e64m-to-support-wind-farms-in-poland/,12,1579651634.0
66,erwkum,Norway party quits government in 'jihadist-wife' row,20,0,europe,,https://www.bbc.co.uk/news/world-europe-51174550,18,1579651368.0
67,erwh6g,"Spain declares climate emergency, gets climate plan ready",78,0,europe,,https://apnews.com/1e946085841af1e942659d4154d75d03,6,1579650943.0
68,erwdhc,The Far-Right Is Going Global: An unofficial visit by nationalist European leaders to Kashmir highlights the solidarity of far-right movements across the globe,2,0,europe,,https://foreignpolicy.com/2020/01/21/india-kashmir-modi-eu-hindu-nationalists-rss-the-far-right-is-going-global/,1,1579650490.0
69,erwaar,Deputy Prime Minister of Ukraine said that Kiev abandoned the idea of ​​a customs union with the EU,3,0,europe,,https://tass.ru/mezhdunarodnaya-panorama/7571251,4,1579650076.0
70,ervyn3,Spanish general election results (1977-2019),13,0,europe,,https://youtu.be/et6i3fEcqw8,2,1579648576.0
71,ervkbj,U.S. PRESSURED DUTCH SAFETY BOARD TO DOWNPLAY TECH FAULTS IN 2009 TURKISH AIRLINES CRASH: REPORT,40,0,europe,,https://nltimes.nl/2020/01/21/us-pressured-dutch-safety-board-downplay-tech-faults-2009-turkish-airlines-crash-report,10,1579646634.0
72,ervjxw,"Latest ONS figures show UK employment rate at record high of 76.3% (a gain of 0.6% year on year), Unemployment rate at 3.8% (0.2% reduction YoY), Wage growth up 3.2% (adjusted for inflation a 1.6% increases)",12,0,europe,,https://www.ons.gov.uk/employmentandlabourmarket/peopleinwork/employmentandemployeetypes/bulletins/uklabourmarket/january2020,6,1579646578.0
73,ervilo,Germany: More and more people work multiple jobs,37,0,europe,,https://www.dw.com/en/germany-more-and-more-people-work-multiple-jobs/a-52082037,33,1579646404.0
74,ervcw3,"In Germany, a Jewish Millennial Argues That the Past Isn’t Past",4,0,europe,,https://www.nytimes.com/2020/01/16/books/max-czollek-germany-desintegriert-euch.html,3,1579645598.0
75,ervaj0,"Lithuanian president cancels trip to Holocaust forum in Israel, to go to Auschwitz instead",225,0,europe,,https://www.lrt.lt/en/news-in-english/19/1135346/lithuanian-president-cancels-trip-to-holocaust-forum-in-israel-to-go-to-auschwitz-instead,83,1579645266.0
76,erv3b3,How Boeing’s Responsibility in a Deadly Crash ‘Got Buried’,34,0,europe,,https://www.nytimes.com/2020/01/20/business/boeing-737-accidents.html,4,1579644237.0
77,erv2hs,EU Projects of Common Interest Energy Infrastructure Investment Map,2,0,europe,,https://britishbusinessenergy.co.uk/pci-map/,1,1579644115.0
78,eruusz,Czech IT specialists organize a hackathon to give government online motorway vignette sales system for free,18,0,europe,,https://www.radio.cz/en/section/curraffrs/czech-it-specialists-organize-hackathon-to-give-government-online-motorway-vignette-sales-system-for-free,9,1579642963.0
79,eruqhx,Athens opens heated shelters for the homeless,34,0,europe,,http://www.ekathimerini.com/248670/article/ekathimerini/news/athens-opens-heated-shelters-for-the-homeless,1,1579642335.0
80,erunuz,"Spain declares climate emergency, gets climate plan ready",7,0,europe,,https://apnews.com/1e946085841af1e942659d4154d75d03,3,1579641946.0
81,eru924,Brexit Costs Nearly Match UK's Total EU Contributions,20326,0,europe,,https://i.redd.it/xccx3stfp4c41.jpg,1405,1579639967.0
82,eru6fd,Russia Screens Chinese Travellers Amid Coronavirus Fears,6,0,europe,,https://www.themoscowtimes.com/2020/01/21/russia-screens-chinese-travellers-amid-coronavirus-fears-a68992,0,1579639624.0
83,ertzqf,British job growth strongest in nearly a year,43,0,europe,,https://news.sky.com/story/british-job-growth-strongest-in-nearly-a-year-11914000,11,1579638547.0
84,ertrtk,Swiss uncovered suspected Davos spy plot by Russian 'plumbers',6,0,europe,,https://www.reuters.com/article/us-davos-meeting-browder/swiss-uncovered-suspected-davos-spy-plot-by-russian-plumbers-paper-idUSKBN1ZK1B0,5,1579637357.0
85,ertprp,Calls for Chinese envoy to be thrown out of Sweden amid diplomatic storm,184,0,europe,,https://www.scmp.com/news/china/diplomacy/article/3047004/calls-chinas-ambassador-be-thrown-out-sweden-amid-diplomatic,54,1579637048.0
86,ertopf,"EU urges Turkey to halt illegal drilling off Cyprus, prepares new sanctions",22,0,europe,,https://www.neweurope.eu/article/eu-urges-turkey-to-halt-illegal-drilling-off-cyprus-prepares-new-sanctions/,8,1579636891.0
87,ertj8j,"Van Gogh self-portrait is genuine, experts decide",5,0,europe,,https://www.bbc.co.uk/news/entertainment-arts-51188829,0,1579636017.0
88,ertium,Belgrade & Pristina agree to resuming direct flights,12,0,europe,,https://www.nytimes.com/2020/01/20/world/europe/serbia-kosovo-flights-resume.html,10,1579635940.0
89,erth5q,Croatian Council Presidency oiled by fossil fuel interests,1,0,europe,,https://corporateeurope.org/en/2020/01/croatian-council-presidency-oiled-fossil-fuel-interests,1,1579635638.0
90,ertf6q,France to shut down 14 nuclear reactors by 2035 - document,67,0,europe,,https://www.reuters.com/article/france-edf/france-to-shut-down-14-nuclear-reactors-by-2035-document-idUSP6N29801N,131,1579635265.0
91,ertexv,How a boy from Vietnam became a slave on a UK cannabis farm,12,0,europe,,https://www.bbc.co.uk/news/stories-51176958,0,1579635218.0
92,ertdjf,[Ireland Election Poll]FF-RE: 25% / FG-EPP: 23% (-6) / SF-LEFT: 21% (+7) / GREEN-G/EFA: 8% / LAB-S&D: 5% (-1) / S-PBP-LEFT: 2% (+1) / SD-S&D: 2% (+1) / I4C-LEFT: 1% (-1) / IA-*: 1% / changes from October 2019,11,0,europe,,https://i.redd.it/g4fd5htmf0c41.jpg,20,1579634983.0
93,ertd63,France Ups 2028 Offshore Wind Tendering Target to 8.75GW,30,0,europe,,https://www.offshorewind.biz/2020/01/21/france-ups-2028-offshore-wind-tendering-target-to-8-75gw/,11,1579634946.0
94,ertc8k,"Deadly storm batters Spain, then shifts to France",9,0,europe,,https://www.bbc.com/news/world-europe-51189589,0,1579634792.0
95,ertbhx,"General Hussein Zabun, commander of Iraq’s federal police: “i would fight to keep the italians in Iraq even if the rest of the coalition had to go away, the Country has an urgent need of them”",38,0,europe,,https://www.corriere.it/esteri/20_gennaio_14/03-esteri-xxcorriere-web-sezioni-36d87cd6-370c-11ea-8c20-22605fcc4a4b.shtml?refresh_ce-cp,5,1579634654.0
96,ert9cq,Denmark's Ørsted is 2020's most sustainable corporation | Corporate Knights,3,0,europe,,https://www.corporateknights.com/channels/leadership/top-company-profile-orsted-15795648/,2,1579634288.0
97,ert7dx,London analysts: Hungary’s growth a big surprise,16,0,europe,,https://bbj.hu/economy/london-analysts-hungarys-growth-a-big-surprise_176831,5,1579633961.0
98,ert6qt,Tesla Aims to Replicate China Success With German Factory,9,0,europe,,https://www.wsj.com/articles/tesla-aims-to-replicate-china-success-with-german-factory-11579602602,3,1579633874.0
99,ert4dh,"Belgian Parliament narrowly rejects resolution asking for the removal of US nuclear weapons, despite 64% of Belgians being in favour of the resolution and only 17% being opposed to it",54,0,europe,,https://www.euractiv.com/section/defence-and-security/news/belgium-debates-phase-out-of-us-nuclear-weapons-on-its-soil/,76,1579633532.0
100,ert2p4,French workers cut power to world's largest food market in pension protest,15,0,europe,,https://www.reuters.com/article/us-france-protests-pensions/french-workers-cut-power-to-worlds-largest-food-market-in-pension-protest-idUSKBN1ZK0TR?il=0,38,1579633296.0
101,errajm,Turkey eyes more EU aid as funding pays off for Syrian refugees,12,0,europe,,https://www.ft.com/content/7abb5212-1c2b-11ea-97df-cc63de1d73f4,12,1579620594.0
102,ersv5i,Conditions from ‘Storm Gloria’ claim three victims across Spain - El País,5,0,europe,,https://elpais.com/elpais/2020/01/20/inenglish/1579520954_315073.html,0,1579631974.0
103,erskti,Brexit: UK to decide on Gibraltar-EU travel deal,2,0,europe,,https://www.bbc.com/news/world-europe-51173850,11,1579629886.0
104,ersjeb,2020 Forecast: Europe,4,0,europe,,https://youtu.be/_BldHrJ2pMU,8,1579629602.0
105,ersfni,Europe’s worst offenders for burning and binning clothes revealed,0,0,europe,,https://www.euronews.com/living/2020/01/20/europe-s-worst-offenders-for-burning-and-binning-clothes-revealed,1,1579628836.0
106,ersbie,Greece’s reverse brain drain: Government scheme offers cash to educated Greeks who moved abroad during the crisis,72,0,europe,,https://www.politico.eu/article/greece-reverse-brain-drain-skills-young-people-financial-crisis/,30,1579627957.0
107,ers6b2,Denmark's 'ghetto plan' and the communities it targets,0,0,europe,,https://www.aljazeera.com/indepth/features/denmark-ghetto-plan-communities-targets-200114061024599.html,19,1579626901.0
108,ers5sp,India and EU have accomplished much. There is more to be done,4,0,europe,,https://indianexpress.com/article/opinion/columns/india-european-union-relations-modi-climate-change-6226828/,0,1579626782.0
109,ers4mj,Thunberg tells Davos 'nothing has been done' to fight climate change,0,0,europe,,https://www.france24.com/en/20200121-thunberg-tells-davos-nothing-has-been-done-to-fight-climate-change?ref=tw_i,36,1579626559.0
110,errzpo,"BIG builds affordable floating village ‘Urban Rigger’ in Copenhagen, Denmark",7,0,europe,,https://www.stirworld.com/see-features-big-builds-affordable-floating-village-urban-rigger-in-copenhagen-denmark,0,1579625568.0
111,errrrc,Roman emperors born on the territory of modern day Serbia,183,0,europe,,https://i.redd.it/m1tiflnjd3c41.jpg,165,1579623887.0
112,errjiq,"Chinese ambassador in Sweden compared Swedish media coverage of China to a lightweight boxer who ""provokes a feud'' with a heavyweight.",5092,0,europe,,https://www.euronews.com/2020/01/19/chinese-official-in-hot-water-after-branding-sweden-lightweight,851,1579622270.0
113,erq8uk,"Czech Muslims face mockery, mosque desecration and death threats",0,0,europe,,https://www.trtworld.com/magazine/czech-muslims-face-mockery-mosque-desecration-and-death-threats-32841,4,1579614118.0
114,err85c,Brussels-Vienna night train returns as Europe eyes flying alternatives,402,0,europe,,https://www.theguardian.com/world/2020/jan/20/brussels-vienna-night-train-returns-as-europe-eyes-flying-alternatives?CMP=Share_iOSApp_Other,144,1579620143.0
115,erqr5a,Chairman of Czech upper house of parliament dies,9,0,europe,,https://www.reuters.com/article/us-czech-kubera/chairman-of-czech-upper-house-of-parliament-dies-idUSKBN1ZJ18W,1,1579617117.0
116,erpn65,Its 7 degrees warm here in Finland,406,0,europe,,https://i.redd.it/miy8rmyla2c41.jpg,189,1579610755.0
